{"$id":"https://github.com/itdojp/private-match-protocol/raw/main/schema/pet-profile-conformance-cases.v0.2.schema.json","$schema":"https://json-schema.org/draft/2020-12/schema","additionalProperties":false,"properties":{"$schema":{"const":"https://json-schema.org/draft/2020-12/schema"},"artifact_status":{"const":"experimental"},"candidate_execution":{"const":false},"catalog_digest":{"pattern":"^sha256:[0-9a-f]{64}$","type":"string"},"catalog_id":{"const":"private-match-pet-profile-conformance-cases"},"invalid_cases":{"items":{"additionalProperties":false,"properties":{"case_id":{"maxLength":2048,"minLength":1,"type":"string"},"expected_error":{"enum":["PET-ABORT-PHASE-AUTHORITY","PET-AUTHORITATIVE-CONTEXT-MISSING","PET-AUTHORITATIVE-TIME-ORDER","PET-BINDING-DUPLICATE-ALIAS","PET-CALLBACK-BINDING","PET-CANCELLATION-CLEANUP","PET-CANDIDATE-EXECUTION-UNAUTHORIZED","PET-CANONICAL-MESSAGE-INVALID","PET-CASE-NOT-EXECUTED","PET-COMMITMENT-BINDING","PET-COMPONENT-AS-COMPLETE","PET-CONTRIBUTIONS-INCOMPLETE","PET-COORDINATOR-PLAINTEXT","PET-CROSS-PROFILE","PET-DECISION-POLICY","PET-DECISION-UNKNOWN","PET-EVALUATION-ATTEMPT","PET-EVALUATION-DEADLINE","PET-EVALUATION-TIME-AUTHORITY","PET-EVIDENCE-SECRET","PET-EXECUTION-AUTHORIZATION-BINDING","PET-EXECUTION-MODE","PET-FAILURE-MAPPING","PET-HANDOFF-EXECUTION-SEMANTICS","PET-LOW-ENTROPY-RECEIPT","PET-MESSAGE-DELIVERY-CLASS","PET-MESSAGE-DIRECTION","PET-MESSAGE-SENDER","PET-MESSAGE-VERIFIER","PET-OBSERVER-RECEIPT","PET-OBSERVER-STAGE","PET-OBSERVER-VISIBILITY","PET-PARTICIPANT-BINDING","PET-POLICY-BINDING","PET-PRODUCTION-EXECUTION-UNSUPPORTED","PET-PROFILE-AUTHORITY","PET-PROFILE-DIGEST-BINDING","PET-PROFILE-INSTANCE","PET-PROFILE-UNKNOWN","PET-PROFILE-VERSION","PET-PROHIBITED-OUTPUT","PET-PSI-SECURITY-ESCALATION","PET-PUBLIC-RESULT-EXPOSURE","PET-QUERY-BUDGET","PET-RECEIPT-BINDING","PET-RECEIPT-POLICY","PET-RESOURCE-POLICY","PET-RESULT-SYMMETRY","PET-SCHEMA-INVALID","PET-SESSION-BINDING","PET-STAGE-PRESTATE","PET-STATE-TRANSITION-PARITY","PET-TEE-DEBUG-MODE","PET-TEE-FRESH-NONCE","PET-TEE-PCR-POLICY","PET-TRANSCRIPT-MISMATCH","PET-VERIFICATION-MATERIAL","PET-VOPRF-COMPLETE-CLAIM"],"maxLength":2048,"minLength":1,"type":"string"},"mutation":{"enum":["abort-ack-binding-missing-profile-id","abort-committed-future-attempt","abort-committed-future-deadline","abort-committed-future-execution-authorization","abort-committed-future-resource-policy","abort-committed-missing-commitment","abort-consumed-budget-refund","abort-created-consumed-budget","abort-created-future-participant","abort-created-impossible-acknowledgments","abort-created-impossible-contributions","abort-created-receipt-inconsistent","abort-created-result-inconsistent","abort-evaluating-accepted-result-before-transition","abort-evaluating-accepted-result-conflict","abort-evaluating-ack-a-missing-proposed-result","abort-evaluating-ack-a-null-receipt","abort-evaluating-ack-b-missing-proposed-result","abort-evaluating-ack-b-null-receipt","abort-evaluating-ack-before-bilateral-contribution","abort-evaluating-ack-missing-proposed-result","abort-evaluating-ack-missing-receipt","abort-evaluating-ack-status-mismatch","abort-evaluating-clears-acknowledged-receipt","abort-evaluating-exposes-party-result","abort-evaluating-missing-attempt","abort-evaluating-missing-deadline","abort-evaluating-missing-execution-authorization","abort-evaluating-missing-resource-policy","abort-evaluating-other-party-proposed-result","abort-evaluating-party-receipt-mismatch","abort-evaluating-profile-evidence-mismatch","abort-evaluating-proposed-without-ack","abort-evaluating-receipt-authority-mismatch","abort-evaluating-redigested-impossible-ack-substate","abort-evaluating-rewrites-proposed-result","abort-evaluating-stale-ack-attempt","abort-evaluating-stale-ack-profile","abort-evaluating-stale-ack-session","abort-evaluating-unacknowledged-future-receipt","abort-evaluating-unconsumed","abort-ordinary-accepted","abort-participants-missing-participant","abort-pending-future-commitment","abort-profile-authority-empty","abort-profile-authority-extra-key","abort-profile-authority-null","abort-redigested-impossible-state","abort-with-fabricated-result","abort-wrong-terminal-phase","attempt-before-evaluation-start","bilateral-results-in-contribution","callback-execution-authority-substitution","callback-missing-raw-execution-authorization","callback-missing-raw-resource-policy","callback-policy-mismatch","callback-raw-execution-state-mismatch","callback-raw-resource-state-mismatch","callback-redigested-resource-authority","callback-resource-policy-substitution","callback-session-mismatch","callback-stale-payload-digest","callback-stale-semantic-digest","callback-state-presented-resource-substitution","cancellation-without-cleanup","commitment-pair-mismatch","component-registration-with-session","component-selected","coordinator-plaintext-result","cross-profile-callback","decision-policy-changed-after-start","decision-policy-default","duplicate-callback-operation-alias","exact-count","execution-authorization-digest-substitution","fixture-with-candidate-flag","incorrect-post-phase","incorrect-pre-phase","incorrect-transition","low-entropy-receipt","matching-element","message-delivery-class-mismatch","message-direction-mismatch","missing-authoritative-context-field","missing-policy-binding","missing-verification-material","nitro-unapproved-candidate-execution","observer-coordinator-visible","observer-on-non-result-case","observer-receipt-mismatch","observer-unknown-decision","other-party-result-in-ack","participant-binding-mismatch","plaintext-result-in-callback-payload","production-execution","profile-digest-mismatch","psi-security-escalation","query-budget-bypass","query-budget-effect-mismatch","receipt-ack-before-contributions","receipt-at-profile-selection","receipt-before-callback","receipt-policy-substitution","redigested-future-field","resource-policy-mismatch","result-asymmetry","results-at-budget-reservation","results-at-evaluation-start","results-at-profile-selection","results-in-public-callback","secret-evidence-hook","secretflow-unapproved-candidate-execution","select-commitment-before-stage","tee-debug-mode","tee-stale-nonce","tee-unapproved-execution","tee-wrong-pcr-policy","timeout-before-deadline","timeout-noncanonical-time","timeout-nonincreasing-time","timeout-ordinary-accepted","timeout-state-message-time-mismatch","timeout-with-new-result","transcript-mutation-mismatch","unexecuted-valid-case","unknown-error-category","unknown-execution-mode","unknown-profile","unknown-symmetric-decision","verification-material-digest-mismatch","verification-material-reference-mismatch","voprf-complete-engine","wrong-callback-sender","wrong-callback-verifier","wrong-evaluation-attempt","wrong-handoff-execution-semantics","wrong-policy-id","wrong-policy-version","wrong-profile-instance","wrong-receipt","wrong-transcript-head","wrong-version"]}},"required":["case_id","mutation","expected_error"],"type":"object"},"maxItems":256,"minItems":138,"type":"array"},"limitations":{"items":{"maxLength":2048,"minLength":1,"type":"string"},"maxItems":128,"minItems":1,"type":"array","uniqueItems":true},"network_execution":{"const":"prohibited"},"operation_stage_digest":{"pattern":"^sha256:[0-9a-f]{64}$","type":"string"},"paid_resource_use":{"const":false},"schema_version":{"const":"0.2"},"synthetic":{"const":true},"valid_cases":{"items":{"additionalProperties":false,"properties":{"abort_acknowledgment_substate":{"enum":["contributions-none","contribution-a-only","contribution-b-only","contributions-complete-no-ack","party-a-acknowledged","party-b-acknowledged","both-acknowledged",null],"type":["string","null"]},"abort_source_phase":{"enum":[null,"CREATED","PARTICIPANTS_BOUND","COMMITMENTS_PENDING","COMMITTED","EVALUATING","RESULT_ACCEPTED","CONSENT_PENDING","DISCLOSURE_AUTHORIZED"]},"canonical_message_path":{"anyOf":[{"maxLength":512,"minLength":1,"pattern":"^(?!/)(?![A-Za-z]:)(?!.*\\\\)(?!.*(?:^|/)\\.\\.?(?:/|$))[A-Za-z0-9._/-]+$","type":"string"},{"type":"null"}]},"case_id":{"maxLength":2048,"minLength":1,"type":"string"},"expected_protocol_outcome":{"enum":["accepted","no-op","terminal"]},"expected_runner_status":{"const":"pass"},"input_digest":{"pattern":"^sha256:[0-9a-f]{64}$","type":"string"},"input_path":{"maxLength":512,"minLength":1,"pattern":"^(?!/)(?![A-Za-z]:)(?!.*\\\\)(?!.*(?:^|/)\\.\\.?(?:/|$))[A-Za-z0-9._/-]+$","type":"string"},"observer_digest":{"anyOf":[{"pattern":"^sha256:[0-9a-f]{64}$","type":"string"},{"type":"null"}]},"operation":{"enum":["register-component","select-profile","reserve-query-budget","start-evaluation","submit-contribution","acknowledge-receipt","accept-profile-callback","evaluation-timeout","abort-and-cleanup"]},"party_slot":{"enum":["a","b",null]},"profile_id":{"maxLength":2048,"minLength":1,"type":"string"},"profile_version":{"const":"0.1"},"prohibited_observations":{"items":{"maxLength":2048,"minLength":1,"type":"string"},"maxItems":128,"minItems":1,"type":"array","uniqueItems":true},"result_digest":{"pattern":"^sha256:[0-9a-f]{64}$","type":"string"}},"required":["case_id","profile_id","profile_version","operation","party_slot","canonical_message_path","input_path","input_digest","result_digest","prohibited_observations","expected_runner_status","expected_protocol_outcome","observer_digest","abort_source_phase","abort_acknowledgment_substate"],"type":"object"},"maxItems":64,"minItems":25,"type":"array"}},"required":["$schema","schema_version","catalog_id","artifact_status","synthetic","network_execution","candidate_execution","paid_resource_use","valid_cases","invalid_cases","limitations","catalog_digest","operation_stage_digest"],"title":"Executable synthetic PET profile conformance cases","type":"object"}
