{"$schema":"https://json-schema.org/draft/2020-12/schema","artifact_status":"experimental","candidate_execution":false,"catalog_digest":"sha256:5d0e4cd58e76a8c3b4dcc70754f24606e255cab977de663fbfc4518f33266dd7","catalog_id":"private-match-pet-profile-conformance-cases","invalid_cases":[{"case_id":"pet-invalid-abort-ack-binding-missing-profile-id-v0.2","expected_error":"PET-PROFILE-AUTHORITY","mutation":"abort-ack-binding-missing-profile-id"},{"case_id":"PET-INVALID-ABORT_COMMITTED_FUTURE_ATTEMPT","expected_error":"PET-ABORT-PHASE-AUTHORITY","mutation":"abort-committed-future-attempt"},{"case_id":"PET-INVALID-ABORT_COMMITTED_FUTURE_DEADLINE","expected_error":"PET-ABORT-PHASE-AUTHORITY","mutation":"abort-committed-future-deadline"},{"case_id":"PET-INVALID-ABORT_COMMITTED_FUTURE_EXECUTION_AUTHORIZATION","expected_error":"PET-ABORT-PHASE-AUTHORITY","mutation":"abort-committed-future-execution-authorization"},{"case_id":"PET-INVALID-ABORT_COMMITTED_FUTURE_RESOURCE_POLICY","expected_error":"PET-ABORT-PHASE-AUTHORITY","mutation":"abort-committed-future-resource-policy"},{"case_id":"PET-INVALID-ABORT_COMMITTED_MISSING_COMMITMENT","expected_error":"PET-ABORT-PHASE-AUTHORITY","mutation":"abort-committed-missing-commitment"},{"case_id":"PET-INVALID-ABORT_CONSUMED_BUDGET_REFUND","expected_error":"PET-STATE-TRANSITION-PARITY","mutation":"abort-consumed-budget-refund"},{"case_id":"PET-INVALID-ABORT_CREATED_CONSUMED_BUDGET","expected_error":"PET-QUERY-BUDGET","mutation":"abort-created-consumed-budget"},{"case_id":"PET-INVALID-ABORT_CREATED_FUTURE_PARTICIPANT","expected_error":"PET-ABORT-PHASE-AUTHORITY","mutation":"abort-created-future-participant"},{"case_id":"PET-INVALID-ABORT_CREATED_IMPOSSIBLE_ACKNOWLEDGMENTS","expected_error":"PET-ABORT-PHASE-AUTHORITY","mutation":"abort-created-impossible-acknowledgments"},{"case_id":"PET-INVALID-ABORT_CREATED_IMPOSSIBLE_CONTRIBUTIONS","expected_error":"PET-ABORT-PHASE-AUTHORITY","mutation":"abort-created-impossible-contributions"},{"case_id":"PET-INVALID-ABORT_CREATED_RECEIPT_INCONSISTENT","expected_error":"PET-ABORT-PHASE-AUTHORITY","mutation":"abort-created-receipt-inconsistent"},{"case_id":"PET-INVALID-ABORT_CREATED_RESULT_INCONSISTENT","expected_error":"PET-ABORT-PHASE-AUTHORITY","mutation":"abort-created-result-inconsistent"},{"case_id":"PET-INVALID-ABORT_EVALUATING_ACCEPTED_RESULT_BEFORE_TRANSITION","expected_error":"PET-ABORT-PHASE-AUTHORITY","mutation":"abort-evaluating-accepted-result-before-transition"},{"case_id":"PET-INVALID-ABORT_EVALUATING_ACCEPTED_RESULT_CONFLICT","expected_error":"PET-ABORT-PHASE-AUTHORITY","mutation":"abort-evaluating-accepted-result-conflict"},{"case_id":"PET-INVALID-ABORT_EVALUATING_ACK_A_MISSING_PROPOSED_RESULT","expected_error":"PET-ABORT-PHASE-AUTHORITY","mutation":"abort-evaluating-ack-a-missing-proposed-result"},{"case_id":"PET-INVALID-ABORT_EVALUATING_ACK_A_NULL_RECEIPT","expected_error":"PET-RECEIPT-BINDING","mutation":"abort-evaluating-ack-a-null-receipt"},{"case_id":"PET-INVALID-ABORT_EVALUATING_ACK_B_MISSING_PROPOSED_RESULT","expected_error":"PET-ABORT-PHASE-AUTHORITY","mutation":"abort-evaluating-ack-b-missing-proposed-result"},{"case_id":"PET-INVALID-ABORT_EVALUATING_ACK_B_NULL_RECEIPT","expected_error":"PET-RECEIPT-BINDING","mutation":"abort-evaluating-ack-b-null-receipt"},{"case_id":"PET-INVALID-ABORT_EVALUATING_ACK_BEFORE_BILATERAL_CONTRIBUTION","expected_error":"PET-ABORT-PHASE-AUTHORITY","mutation":"abort-evaluating-ack-before-bilateral-contribution"},{"case_id":"PET-INVALID-ABORT_EVALUATING_ACK_MISSING_PROPOSED_RESULT","expected_error":"PET-ABORT-PHASE-AUTHORITY","mutation":"abort-evaluating-ack-missing-proposed-result"},{"case_id":"PET-INVALID-ABORT_EVALUATING_ACK_MISSING_RECEIPT","expected_error":"PET-RECEIPT-BINDING","mutation":"abort-evaluating-ack-missing-receipt"},{"case_id":"PET-INVALID-ABORT_EVALUATING_ACK_STATUS_MISMATCH","expected_error":"PET-CALLBACK-BINDING","mutation":"abort-evaluating-ack-status-mismatch"},{"case_id":"PET-INVALID-ABORT_EVALUATING_CLEARS_ACKNOWLEDGED_RECEIPT","expected_error":"PET-STATE-TRANSITION-PARITY","mutation":"abort-evaluating-clears-acknowledged-receipt"},{"case_id":"PET-INVALID-ABORT_EVALUATING_EXPOSES_PARTY_RESULT","expected_error":"PET-PUBLIC-RESULT-EXPOSURE","mutation":"abort-evaluating-exposes-party-result"},{"case_id":"PET-INVALID-ABORT_EVALUATING_MISSING_ATTEMPT","expected_error":"PET-ABORT-PHASE-AUTHORITY","mutation":"abort-evaluating-missing-attempt"},{"case_id":"PET-INVALID-ABORT_EVALUATING_MISSING_DEADLINE","expected_error":"PET-ABORT-PHASE-AUTHORITY","mutation":"abort-evaluating-missing-deadline"},{"case_id":"PET-INVALID-ABORT_EVALUATING_MISSING_EXECUTION_AUTHORIZATION","expected_error":"PET-ABORT-PHASE-AUTHORITY","mutation":"abort-evaluating-missing-execution-authorization"},{"case_id":"PET-INVALID-ABORT_EVALUATING_MISSING_RESOURCE_POLICY","expected_error":"PET-ABORT-PHASE-AUTHORITY","mutation":"abort-evaluating-missing-resource-policy"},{"case_id":"PET-INVALID-ABORT_EVALUATING_OTHER_PARTY_PROPOSED_RESULT","expected_error":"PET-ABORT-PHASE-AUTHORITY","mutation":"abort-evaluating-other-party-proposed-result"},{"case_id":"PET-INVALID-ABORT_EVALUATING_PARTY_RECEIPT_MISMATCH","expected_error":"PET-RECEIPT-BINDING","mutation":"abort-evaluating-party-receipt-mismatch"},{"case_id":"PET-INVALID-ABORT_EVALUATING_PROFILE_EVIDENCE_MISMATCH","expected_error":"PET-CALLBACK-BINDING","mutation":"abort-evaluating-profile-evidence-mismatch"},{"case_id":"PET-INVALID-ABORT_EVALUATING_PROPOSED_WITHOUT_ACK","expected_error":"PET-ABORT-PHASE-AUTHORITY","mutation":"abort-evaluating-proposed-without-ack"},{"case_id":"PET-INVALID-ABORT_EVALUATING_RECEIPT_AUTHORITY_MISMATCH","expected_error":"PET-RECEIPT-BINDING","mutation":"abort-evaluating-receipt-authority-mismatch"},{"case_id":"PET-INVALID-ABORT_EVALUATING_REDIGESTED_IMPOSSIBLE_ACK_SUBSTATE","expected_error":"PET-ABORT-PHASE-AUTHORITY","mutation":"abort-evaluating-redigested-impossible-ack-substate"},{"case_id":"PET-INVALID-ABORT_EVALUATING_REWRITES_PROPOSED_RESULT","expected_error":"PET-STATE-TRANSITION-PARITY","mutation":"abort-evaluating-rewrites-proposed-result"},{"case_id":"PET-INVALID-ABORT_EVALUATING_STALE_ACK_ATTEMPT","expected_error":"PET-EVALUATION-ATTEMPT","mutation":"abort-evaluating-stale-ack-attempt"},{"case_id":"PET-INVALID-ABORT_EVALUATING_STALE_ACK_PROFILE","expected_error":"PET-CROSS-PROFILE","mutation":"abort-evaluating-stale-ack-profile"},{"case_id":"PET-INVALID-ABORT_EVALUATING_STALE_ACK_SESSION","expected_error":"PET-SESSION-BINDING","mutation":"abort-evaluating-stale-ack-session"},{"case_id":"PET-INVALID-ABORT_EVALUATING_UNACKNOWLEDGED_FUTURE_RECEIPT","expected_error":"PET-RECEIPT-BINDING","mutation":"abort-evaluating-unacknowledged-future-receipt"},{"case_id":"PET-INVALID-ABORT_EVALUATING_UNCONSUMED","expected_error":"PET-QUERY-BUDGET","mutation":"abort-evaluating-unconsumed"},{"case_id":"PET-INVALID-ABORT_ORDINARY_ACCEPTED","expected_error":"PET-STATE-TRANSITION-PARITY","mutation":"abort-ordinary-accepted"},{"case_id":"PET-INVALID-ABORT_PARTICIPANTS_MISSING_PARTICIPANT","expected_error":"PET-ABORT-PHASE-AUTHORITY","mutation":"abort-participants-missing-participant"},{"case_id":"PET-INVALID-ABORT_PENDING_FUTURE_COMMITMENT","expected_error":"PET-ABORT-PHASE-AUTHORITY","mutation":"abort-pending-future-commitment"},{"case_id":"pet-invalid-abort-profile-authority-empty-v0.2","expected_error":"PET-PROFILE-AUTHORITY","mutation":"abort-profile-authority-empty"},{"case_id":"pet-invalid-abort-profile-authority-extra-key-v0.2","expected_error":"PET-PROFILE-AUTHORITY","mutation":"abort-profile-authority-extra-key"},{"case_id":"pet-invalid-abort-profile-authority-null-v0.2","expected_error":"PET-PROFILE-AUTHORITY","mutation":"abort-profile-authority-null"},{"case_id":"PET-INVALID-ABORT_REDIGESTED_IMPOSSIBLE_STATE","expected_error":"PET-ABORT-PHASE-AUTHORITY","mutation":"abort-redigested-impossible-state"},{"case_id":"PET-INVALID-ABORT_WITH_FABRICATED_RESULT","expected_error":"PET-PUBLIC-RESULT-EXPOSURE","mutation":"abort-with-fabricated-result"},{"case_id":"PET-INVALID-ABORT_WRONG_TERMINAL_PHASE","expected_error":"PET-STATE-TRANSITION-PARITY","mutation":"abort-wrong-terminal-phase"},{"case_id":"PET-INVALID-ATTEMPT_BEFORE_EVALUATION_START","expected_error":"PET-SCHEMA-INVALID","mutation":"attempt-before-evaluation-start"},{"case_id":"PET-INVALID-BILATERAL_RESULTS_IN_CONTRIBUTION","expected_error":"PET-PUBLIC-RESULT-EXPOSURE","mutation":"bilateral-results-in-contribution"},{"case_id":"PET-INVALID-CALLBACK_EXECUTION_AUTHORITY_SUBSTITUTION","expected_error":"PET-EXECUTION-AUTHORIZATION-BINDING","mutation":"callback-execution-authority-substitution"},{"case_id":"PET-INVALID-CALLBACK_MISSING_RAW_EXECUTION_AUTHORIZATION","expected_error":"PET-CANONICAL-MESSAGE-INVALID","mutation":"callback-missing-raw-execution-authorization"},{"case_id":"PET-INVALID-CALLBACK_MISSING_RAW_RESOURCE_POLICY","expected_error":"PET-CANONICAL-MESSAGE-INVALID","mutation":"callback-missing-raw-resource-policy"},{"case_id":"PET-INVALID-CALLBACK_POLICY_MISMATCH","expected_error":"PET-POLICY-BINDING","mutation":"callback-policy-mismatch"},{"case_id":"PET-INVALID-CALLBACK_RAW_EXECUTION_STATE_MISMATCH","expected_error":"PET-EXECUTION-AUTHORIZATION-BINDING","mutation":"callback-raw-execution-state-mismatch"},{"case_id":"PET-INVALID-CALLBACK_RAW_RESOURCE_STATE_MISMATCH","expected_error":"PET-RESOURCE-POLICY","mutation":"callback-raw-resource-state-mismatch"},{"case_id":"PET-INVALID-CALLBACK_REDIGESTED_RESOURCE_AUTHORITY","expected_error":"PET-RESOURCE-POLICY","mutation":"callback-redigested-resource-authority"},{"case_id":"PET-INVALID-CALLBACK_RESOURCE_POLICY_SUBSTITUTION","expected_error":"PET-RESOURCE-POLICY","mutation":"callback-resource-policy-substitution"},{"case_id":"PET-INVALID-CALLBACK_SESSION_MISMATCH","expected_error":"PET-SESSION-BINDING","mutation":"callback-session-mismatch"},{"case_id":"PET-INVALID-CALLBACK_STALE_PAYLOAD_DIGEST","expected_error":"PET-CANONICAL-MESSA